{
  "schema": "math-commons-release-readback/v1",
  "status": "PASS",
  "observed_date": "2026-08-21",
  "subject": {
    "repository": "KokunoYumeto/mathematics-commons-pilot",
    "commit": "049a2c9c351e827c85e69f21c2ebd0c3a98db705",
    "main_commit_at_readback": "049a2c9c351e827c85e69f21c2ebd0c3a98db705",
    "tag": "jobs-2026-08-21-r1",
    "tag_commit": "049a2c9c351e827c85e69f21c2ebd0c3a98db705",
    "release_id": 374306971,
    "release_url": "https://github.com/KokunoYumeto/mathematics-commons-pilot/releases/tag/jobs-2026-08-21-r1"
  },
  "transport": {
    "method": "anonymous_https",
    "authorization": "none",
    "cookies": "none",
    "persistence": "none"
  },
  "assets": [
    {
      "name": "al-battani-nallino-opus-astronomicum-1899-1907.zip",
      "url": "https://github.com/KokunoYumeto/mathematics-commons-pilot/releases/download/jobs-2026-08-21-r1/al-battani-nallino-opus-astronomicum-1899-1907.zip",
      "expected_bytes": 116632760,
      "observed_bytes": 116632760,
      "expected_sha256": "8220D4A6B61807E8EF8BF1A2070D8DEFBCA41B1588EA907D93C37A5B82B3A8A6",
      "observed_sha256": "8220D4A6B61807E8EF8BF1A2070D8DEFBCA41B1588EA907D93C37A5B82B3A8A6",
      "match": true
    },
    {
      "name": "al-khwarizmi-al-jabr-cairo-1939.zip",
      "url": "https://github.com/KokunoYumeto/mathematics-commons-pilot/releases/download/jobs-2026-08-21-r1/al-khwarizmi-al-jabr-cairo-1939.zip",
      "expected_bytes": 363559181,
      "observed_bytes": 363559181,
      "expected_sha256": "4A21D9D017961B310AA809822B9A48F7940B4B7F6809EEC9BFD9C2807B57E979",
      "observed_sha256": "4A21D9D017961B310AA809822B9A48F7940B4B7F6809EEC9BFD9C2807B57E979",
      "match": true
    },
    {
      "name": "al-tusi-quadrilateral-french-1891.zip",
      "url": "https://github.com/KokunoYumeto/mathematics-commons-pilot/releases/download/jobs-2026-08-21-r1/al-tusi-quadrilateral-french-1891.zip",
      "expected_bytes": 285111794,
      "observed_bytes": 285111794,
      "expected_sha256": "80219F7424F0E42F8E9501132E22178CF973E4BA821CA0AD6A25B08A6F3BF599",
      "observed_sha256": "80219F7424F0E42F8E9501132E22178CF973E4BA821CA0AD6A25B08A6F3BF599",
      "match": true
    },
    {
      "name": "aryabhatiya-jyotihsastram-1906.zip",
      "url": "https://github.com/KokunoYumeto/mathematics-commons-pilot/releases/download/jobs-2026-08-21-r1/aryabhatiya-jyotihsastram-1906.zip",
      "expected_bytes": 214008649,
      "observed_bytes": 214008649,
      "expected_sha256": "8E8209A1E5DB661DA65A2E7F0839DE9CB2C0EEF563D358AD6D0A60805BB508BE",
      "observed_sha256": "8E8209A1E5DB661DA65A2E7F0839DE9CB2C0EEF563D358AD6D0A60805BB508BE",
      "match": true
    },
    {
      "name": "bhaskara-bijaganita-apte-1930.zip",
      "url": "https://github.com/KokunoYumeto/mathematics-commons-pilot/releases/download/jobs-2026-08-21-r1/bhaskara-bijaganita-apte-1930.zip",
      "expected_bytes": 5684311,
      "observed_bytes": 5684311,
      "expected_sha256": "49AEF771FD526FE554B4425A90DE0EE8FF7ECC2313ACEEB00F3F488F340FE52F",
      "observed_sha256": "49AEF771FD526FE554B4425A90DE0EE8FF7ECC2313ACEEB00F3F488F340FE52F",
      "match": true
    },
    {
      "name": "bhaskara-lilavati-1907.zip",
      "url": "https://github.com/KokunoYumeto/mathematics-commons-pilot/releases/download/jobs-2026-08-21-r1/bhaskara-lilavati-1907.zip",
      "expected_bytes": 509068073,
      "observed_bytes": 509068073,
      "expected_sha256": "55BAC857810A2CAA8B7F02F3E24E10867E16F43A725287C2D5471CDC8C73956B",
      "observed_sha256": "55BAC857810A2CAA8B7F02F3E24E10867E16F43A725287C2D5471CDC8C73956B",
      "match": true
    },
    {
      "name": "cayley-collected-papers-v01.zip",
      "url": "https://github.com/KokunoYumeto/mathematics-commons-pilot/releases/download/jobs-2026-08-21-r1/cayley-collected-papers-v01.zip",
      "expected_bytes": 171920031,
      "observed_bytes": 171920031,
      "expected_sha256": "16809E3B0DE820B69AFF2DCD1250171850A67D745C44CE5208DFCAAD8CA8DDE1",
      "observed_sha256": "16809E3B0DE820B69AFF2DCD1250171850A67D745C44CE5208DFCAAD8CA8DDE1",
      "match": true
    },
    {
      "name": "clebsch-gordan-abelian-functions-1866.zip",
      "url": "https://github.com/KokunoYumeto/mathematics-commons-pilot/releases/download/jobs-2026-08-21-r1/clebsch-gordan-abelian-functions-1866.zip",
      "expected_bytes": 33257102,
      "observed_bytes": 33257102,
      "expected_sha256": "847F2DD240BA3D960F175FB1144C4E272A2B2963100F654C6A878A02FCB76C5E",
      "observed_sha256": "847F2DD240BA3D960F175FB1144C4E272A2B2963100F654C6A878A02FCB76C5E",
      "match": true
    },
    {
      "name": "dedekind-werke-v01.zip",
      "url": "https://github.com/KokunoYumeto/mathematics-commons-pilot/releases/download/jobs-2026-08-21-r1/dedekind-werke-v01.zip",
      "expected_bytes": 18586622,
      "observed_bytes": 18586622,
      "expected_sha256": "1CAA2B4F590D2E3B184722A58068A5AB82FAF92C976DDCF64F6A704D834D4CBC",
      "observed_sha256": "1CAA2B4F590D2E3B184722A58068A5AB82FAF92C976DDCF64F6A704D834D4CBC",
      "match": true
    },
    {
      "name": "dedekind-werke-v03.zip",
      "url": "https://github.com/KokunoYumeto/mathematics-commons-pilot/releases/download/jobs-2026-08-21-r1/dedekind-werke-v03.zip",
      "expected_bytes": 25297321,
      "observed_bytes": 25297321,
      "expected_sha256": "07585C124865618181F9DD5F80339C253DEAAAE907ED32DC13107AACF150150E",
      "observed_sha256": "07585C124865618181F9DD5F80339C253DEAAAE907ED32DC13107AACF150150E",
      "match": true
    },
    {
      "name": "gauss-werke-v02-with-nachtrag.zip",
      "url": "https://github.com/KokunoYumeto/mathematics-commons-pilot/releases/download/jobs-2026-08-21-r1/gauss-werke-v02-with-nachtrag.zip",
      "expected_bytes": 34492446,
      "observed_bytes": 34492446,
      "expected_sha256": "DB83D1543D18B1BAF5090D0E45F48D26A71726123E04E126793A852659C8813B",
      "observed_sha256": "DB83D1543D18B1BAF5090D0E45F48D26A71726123E04E126793A852659C8813B",
      "match": true
    },
    {
      "name": "gibbs-scientific-papers-v01.zip",
      "url": "https://github.com/KokunoYumeto/mathematics-commons-pilot/releases/download/jobs-2026-08-21-r1/gibbs-scientific-papers-v01.zip",
      "expected_bytes": 101594634,
      "observed_bytes": 101594634,
      "expected_sha256": "9454671A66D04571C6D1CB9ECDB3D452D62743C0102981E3CA10A7D799A14197",
      "observed_sha256": "9454671A66D04571C6D1CB9ECDB3D452D62743C0102981E3CA10A7D799A14197",
      "match": true
    },
    {
      "name": "gordan-de-linea-geodetica-1862.zip",
      "url": "https://github.com/KokunoYumeto/mathematics-commons-pilot/releases/download/jobs-2026-08-21-r1/gordan-de-linea-geodetica-1862.zip",
      "expected_bytes": 5289425,
      "observed_bytes": 5289425,
      "expected_sha256": "DAFD37A69C4D210888B5CE53036BCDF6E7BDE2940E6BEC9354ED2C7426F0852B",
      "observed_sha256": "DAFD37A69C4D210888B5CE53036BCDF6E7BDE2940E6BEC9354ED2C7426F0852B",
      "match": true
    },
    {
      "name": "gordan-formensystem-binaerer-formen.zip",
      "url": "https://github.com/KokunoYumeto/mathematics-commons-pilot/releases/download/jobs-2026-08-21-r1/gordan-formensystem-binaerer-formen.zip",
      "expected_bytes": 28838866,
      "observed_bytes": 28838866,
      "expected_sha256": "FDE297476D20434B53E5BB429B939036272861180D52E0D41AA8CC570FA76A47",
      "observed_sha256": "FDE297476D20434B53E5BB429B939036272861180D52E0D41AA8CC570FA76A47",
      "match": true
    },
    {
      "name": "gordan-transformation-thetafunctionen-1863.zip",
      "url": "https://github.com/KokunoYumeto/mathematics-commons-pilot/releases/download/jobs-2026-08-21-r1/gordan-transformation-thetafunctionen-1863.zip",
      "expected_bytes": 9662068,
      "observed_bytes": 9662068,
      "expected_sha256": "52C9E7AC49D3648D447ACC18E567C07CFD12B2F7A2CEE01C4CCD06A2AD5D6AD2",
      "observed_sha256": "52C9E7AC49D3648D447ACC18E567C07CFD12B2F7A2CEE01C4CCD06A2AD5D6AD2",
      "match": true
    },
    {
      "name": "gordan-invariantentheorie-v01-1885.zip",
      "url": "https://github.com/KokunoYumeto/mathematics-commons-pilot/releases/download/jobs-2026-08-21-r1/gordan-invariantentheorie-v01-1885.zip",
      "expected_bytes": 61540374,
      "observed_bytes": 61540374,
      "expected_sha256": "44838A95D1FD4A7BAD3FA01DB7A4009BF2A510312B45959DF9E9D54145FE09BE",
      "observed_sha256": "44838A95D1FD4A7BAD3FA01DB7A4009BF2A510312B45959DF9E9D54145FE09BE",
      "match": true
    },
    {
      "name": "gordan-invariantentheorie-v02-1887.zip",
      "url": "https://github.com/KokunoYumeto/mathematics-commons-pilot/releases/download/jobs-2026-08-21-r1/gordan-invariantentheorie-v02-1887.zip",
      "expected_bytes": 64524465,
      "observed_bytes": 64524465,
      "expected_sha256": "BEF538E2B95FA108E830ED098C37E4F7F3A4F1D0FF797A41EED225C7B048010F",
      "observed_sha256": "BEF538E2B95FA108E830ED098C37E4F7F3A4F1D0FF797A41EED225C7B048010F",
      "match": true
    },
    {
      "name": "hecke-algebraische-zahlen-1923.zip",
      "url": "https://github.com/KokunoYumeto/mathematics-commons-pilot/releases/download/jobs-2026-08-21-r1/hecke-algebraische-zahlen-1923.zip",
      "expected_bytes": 364181159,
      "observed_bytes": 364181159,
      "expected_sha256": "5D599DDB2E6243A992F4CF252380F20538D78EFC7E06DCEFB1AB862900333797",
      "observed_sha256": "5D599DDB2E6243A992F4CF252380F20538D78EFC7E06DCEFB1AB862900333797",
      "match": true
    },
    {
      "name": "khayyam-columbia-ms-or34-algebra.zip",
      "url": "https://github.com/KokunoYumeto/mathematics-commons-pilot/releases/download/jobs-2026-08-21-r1/khayyam-columbia-ms-or34-algebra.zip",
      "expected_bytes": 331477722,
      "observed_bytes": 331477722,
      "expected_sha256": "A5BE6A85251CB160A6C015490AFC1000AC2FA00515853131BF03034CBA73F96C",
      "observed_sha256": "A5BE6A85251CB160A6C015490AFC1000AC2FA00515853131BF03034CBA73F96C",
      "match": true
    },
    {